{
  "id": "valid-v01-001",
  "profile": "schema",
  "description": "Minimal valid v0.1 manifest (frozen Phase 1 contract).",
  "input": {
    "schema_version": "0.1.0",
    "source": {
      "id": "conf"
    },
    "actions": [
      {
        "id": "act_001",
        "kind": "event",
        "title": "秋の遠足",
        "modality": "required",
        "actor": {
          "certainty": "unknown"
        },
        "evidence": [
          {
            "source_id": "conf",
            "text": "令和8年10月15日に秋の遠足を実施します。"
          }
        ],
        "inference": "explicit",
        "status": "proposed"
      }
    ]
  },
  "expected": {
    "valid": true
  }
}
