{
  "id": "v01-with-v02-fields-001",
  "profile": "schema",
  "description": "A 0.1.0 manifest MUST NOT carry v0.2-only per-action verification fields (frozen v0.1 schema has none).",
  "input": {
    "schema_version": "0.1.0",
    "source": {
      "id": "conf"
    },
    "actions": [
      {
        "id": "act_001",
        "kind": "event",
        "title": "秋の遠足",
        "modality": "required",
        "actor": {
          "certainty": "unknown"
        },
        "evidence": [
          {
            "source_id": "conf",
            "text": "令和8年10月15日に秋の遠足を実施します。"
          }
        ],
        "inference": "explicit",
        "status": "proposed"
      }
    ],
    "receipt": {
      "extraction": {
        "provider": "p",
        "model": "m",
        "extractor_version": "0",
        "schema_version": "0.1.0",
        "created_at": "2026-01-01T00:00:00.000Z"
      },
      "verification": {
        "evidence_supported": true,
        "temporal_supported": true,
        "actor_supported": true,
        "modality_supported": true,
        "source_hash_matched": true,
        "negation_conflict": false,
        "page_refs_valid": true,
        "passed": true,
        "actions": []
      }
    }
  },
  "expected": {
    "valid": false,
    "error_code": "SCHEMA_VALIDATION"
  }
}
