{
  "id": "valid-x-extension-001",
  "profile": "schema",
  "description": "kind/modality accept x-* extensions for forward compatibility.",
  "input": {
    "schema_version": "0.2.0",
    "source": {
      "id": "conf"
    },
    "actions": [
      {
        "id": "act_001",
        "kind": "x-school-event",
        "title": "秋の遠足",
        "modality": "x-strongly-encouraged",
        "actor": {
          "certainty": "unknown"
        },
        "evidence": [
          {
            "source_id": "conf",
            "text": "令和8年10月15日に秋の遠足を実施します。"
          }
        ],
        "inference": "explicit",
        "status": "proposed"
      }
    ]
  },
  "expected": {
    "valid": true
  }
}
